{
  "project_id": "EXAMPLE-FRIDGE-001",
  "scene_id": "S1",
  "asset_id": "A1",
  "entity_ids": [
    "fridge_01"
  ],
  "canonical_description": "Matte white freestanding two-door top-freezer refrigerator in an ordinary home kitchen, viewed initially from a rear three-quarter angle.",
  "invariant_features": [
    "matte white body",
    "same top-freezer/two-door geometry",
    "same door proportions",
    "same handle/recess geometry",
    "same overall width-height proportions",
    "same kitchen environment when the physical object is visible"
  ],
  "forbidden_variations": [
    "change to stainless-steel finish",
    "change to French-door or side-by-side layout",
    "change door count or proportions",
    "replace with a different refrigerator model",
    "move to an unrelated kitchen without a context switch",
    "alter component locations merely for visual convenience"
  ],
  "continuity_constraints": [
    "All physical refrigerator scenes must derive from A1 or an approved derivative.",
    "Technical abstractions should preserve the recognizable fridge_01 silhouette when shown together with the appliance.",
    "Scene 5 may compare heat-rejection layouts but must keep fridge_01 as the primary example."
  ],
  "style": {
    "realism_target": "technical_realistic",
    "lighting": "Soft natural indoor daylight with believable room shadows; no studio glow.",
    "camera_style": "Grounded real-camera perspective, mostly rear three-quarter and controlled cutaway views.",
    "environment": "Ordinary compact home kitchen; realistic wall clearance and everyday surfaces.",
    "color_notes": "Neutral household colors; refrigerator remains matte white.",
    "forbidden_style_traits": [
      "hyper-polished CGI",
      "neon rim lighting",
      "excessive depth of field",
      "perfectly symmetrical showroom staging",
      "unmotivated environment changes"
    ]
  },
  "technical_constraints": [
    "Do not expose invented internal components in the anchor image.",
    "Keep the rear three-quarter view suitable for later cutaway overlays."
  ],
  "output_spec": {
    "aspect_ratio": "9:16",
    "width": 1080,
    "height": 1920,
    "transparent_background": false
  },
  "attempt": 0
}